{
  "candidates": [
    {
      "candidateId": "zone-vault",
      "confidence": "high",
      "displayName": "Vault",
      "equipment": [
        "Vault"
      ],
      "logicalZoneId": "vault",
      "mayRepresentDisconnectedAreas": false,
      "ownerReview": {
        "configurationEligible": false,
        "confirmed": false,
        "status": "owner_confirmation_required"
      },
      "reasonCodes": [
        "equipment_exactly_matches_schedule_inventory",
        "canonical_label_mentions_all_member_equipment",
        "owner_confirmation_required"
      ],
      "sourceEvidence": {
        "activityTypeCounts": {
          "conditioning": 2,
          "rotation": 73
        },
        "bookingCount": 75,
        "canonicalLabels": [
          "Cond Vault",
          "Vault",
          "Vault cond"
        ],
        "labelMentionsAllEquipmentCount": 75,
        "sourceConfidenceCounts": {
          "high": 75
        },
        "sourceReviewStatusCounts": {
          "auto_extracted": 63,
          "color_inferred": 12
        }
      },
      "suggestedBoardKind": "single_area"
    },
    {
      "candidateId": "zone-pit",
      "confidence": "high",
      "displayName": "Pit",
      "equipment": [
        "Pit"
      ],
      "logicalZoneId": "pit",
      "mayRepresentDisconnectedAreas": false,
      "ownerReview": {
        "configurationEligible": false,
        "confirmed": false,
        "status": "owner_confirmation_required"
      },
      "reasonCodes": [
        "equipment_exactly_matches_schedule_inventory",
        "canonical_label_mentions_all_member_equipment",
        "owner_confirmation_required"
      ],
      "sourceEvidence": {
        "activityTypeCounts": {
          "rotation": 40
        },
        "bookingCount": 40,
        "canonicalLabels": [
          "Pit"
        ],
        "labelMentionsAllEquipmentCount": 40,
        "sourceConfidenceCounts": {
          "high": 40
        },
        "sourceReviewStatusCounts": {
          "auto_extracted": 40
        }
      },
      "suggestedBoardKind": "single_area"
    },
    {
      "candidateId": "zone-pit-pb",
      "confidence": "high",
      "displayName": "Pit PB",
      "equipment": [
        "Pit PB"
      ],
      "logicalZoneId": "pit-pb",
      "mayRepresentDisconnectedAreas": false,
      "ownerReview": {
        "configurationEligible": false,
        "confirmed": false,
        "status": "owner_confirmation_required"
      },
      "reasonCodes": [
        "equipment_exactly_matches_schedule_inventory",
        "canonical_label_mentions_all_member_equipment",
        "owner_confirmation_required"
      ],
      "sourceEvidence": {
        "activityTypeCounts": {
          "rotation": 1
        },
        "bookingCount": 1,
        "canonicalLabels": [
          "Pit PB"
        ],
        "labelMentionsAllEquipmentCount": 1,
        "sourceConfidenceCounts": {
          "high": 1
        },
        "sourceReviewStatusCounts": {
          "auto_extracted": 1
        }
      },
      "suggestedBoardKind": "single_area"
    },
    {
      "candidateId": "zone-strap-bar",
      "confidence": "medium",
      "displayName": "Strap Bar",
      "equipment": [
        "Strap Bar"
      ],
      "logicalZoneId": "strap-bar",
      "mayRepresentDisconnectedAreas": false,
      "ownerReview": {
        "configurationEligible": false,
        "confirmed": false,
        "status": "owner_confirmation_required"
      },
      "reasonCodes": [
        "equipment_exactly_matches_schedule_inventory",
        "owner_confirmation_required"
      ],
      "sourceEvidence": {
        "activityTypeCounts": {
          "rotation": 2
        },
        "bookingCount": 2,
        "canonicalLabels": [
          "strap"
        ],
        "labelMentionsAllEquipmentCount": 0,
        "sourceConfidenceCounts": {
          "high": 2
        },
        "sourceReviewStatusCounts": {
          "auto_extracted": 2
        }
      },
      "suggestedBoardKind": "single_area"
    },
    {
      "candidateId": "zone-beam-1",
      "confidence": "high",
      "displayName": "Beam 1",
      "equipment": [
        "Beam 1"
      ],
      "logicalZoneId": "beam-1",
      "mayRepresentDisconnectedAreas": false,
      "ownerReview": {
        "configurationEligible": false,
        "confirmed": false,
        "status": "owner_confirmation_required"
      },
      "reasonCodes": [
        "equipment_exactly_matches_schedule_inventory",
        "canonical_label_mentions_all_member_equipment",
        "owner_confirmation_required"
      ],
      "sourceEvidence": {
        "activityTypeCounts": {
          "rotation": 42,
          "warmup": 2
        },
        "bookingCount": 44,
        "canonicalLabels": [
          "Beam 1",
          "Beam 1 cond",
          "WU Beam 1"
        ],
        "labelMentionsAllEquipmentCount": 44,
        "sourceConfidenceCounts": {
          "high": 44
        },
        "sourceReviewStatusCounts": {
          "auto_extracted": 44
        }
      },
      "suggestedBoardKind": "single_area"
    },
    {
      "candidateId": "zone-beam-2",
      "confidence": "medium",
      "displayName": "Beam 2",
      "equipment": [
        "Beam 2"
      ],
      "logicalZoneId": "beam-2",
      "mayRepresentDisconnectedAreas": false,
      "ownerReview": {
        "configurationEligible": false,
        "confirmed": false,
        "status": "owner_confirmation_required"
      },
      "reasonCodes": [
        "equipment_exactly_matches_schedule_inventory",
        "canonical_label_mentions_all_member_equipment",
        "source_contains_review_needed_evidence",
        "owner_confirmation_required"
      ],
      "sourceEvidence": {
        "activityTypeCounts": {
          "rotation": 90,
          "warmup": 5
        },
        "bookingCount": 95,
        "canonicalLabels": [
          "Beam 2",
          "WU Beam 2"
        ],
        "labelMentionsAllEquipmentCount": 95,
        "sourceConfidenceCounts": {
          "high": 90,
          "medium": 5
        },
        "sourceReviewStatusCounts": {
          "auto_extracted": 90,
          "color_inferred_needs_review": 5
        }
      },
      "suggestedBoardKind": "single_area"
    },
    {
      "candidateId": "zone-ub-3",
      "confidence": "low",
      "displayName": "UB 3",
      "equipment": [
        "UB 3"
      ],
      "logicalZoneId": "ub-3",
      "mayRepresentDisconnectedAreas": false,
      "ownerReview": {
        "configurationEligible": false,
        "confirmed": false,
        "status": "owner_confirmation_required"
      },
      "reasonCodes": [
        "equipment_exactly_matches_schedule_inventory",
        "canonical_label_mentions_all_member_equipment",
        "source_contains_low_confidence_evidence",
        "source_contains_review_needed_evidence",
        "owner_confirmation_required"
      ],
      "sourceEvidence": {
        "activityTypeCounts": {
          "rotation": 81,
          "warmup": 4
        },
        "bookingCount": 85,
        "canonicalLabels": [
          "UB 3",
          "UB 3 Cond",
          "UB 3 cond",
          "WU UB 3",
          "WU UB 3 UB 3"
        ],
        "labelMentionsAllEquipmentCount": 85,
        "sourceConfidenceCounts": {
          "high": 83,
          "low": 2
        },
        "sourceReviewStatusCounts": {
          "auto_extracted": 83,
          "color_inferred_needs_review": 2
        }
      },
      "suggestedBoardKind": "single_area"
    },
    {
      "candidateId": "zone-f1",
      "confidence": "high",
      "displayName": "F1",
      "equipment": [
        "F1"
      ],
      "logicalZoneId": "f1",
      "mayRepresentDisconnectedAreas": false,
      "ownerReview": {
        "configurationEligible": false,
        "confirmed": false,
        "status": "owner_confirmation_required"
      },
      "reasonCodes": [
        "equipment_exactly_matches_schedule_inventory",
        "canonical_label_mentions_all_member_equipment",
        "owner_confirmation_required"
      ],
      "sourceEvidence": {
        "activityTypeCounts": {
          "rotation": 50
        },
        "bookingCount": 50,
        "canonicalLabels": [
          "F1",
          "Vault F1"
        ],
        "labelMentionsAllEquipmentCount": 50,
        "sourceConfidenceCounts": {
          "high": 50
        },
        "sourceReviewStatusCounts": {
          "auto_extracted": 47,
          "color_inferred": 3
        }
      },
      "suggestedBoardKind": "single_area"
    },
    {
      "candidateId": "zone-f2",
      "confidence": "high",
      "displayName": "F2",
      "equipment": [
        "F2"
      ],
      "logicalZoneId": "f2",
      "mayRepresentDisconnectedAreas": false,
      "ownerReview": {
        "configurationEligible": false,
        "confirmed": false,
        "status": "owner_confirmation_required"
      },
      "reasonCodes": [
        "equipment_exactly_matches_schedule_inventory",
        "canonical_label_mentions_all_member_equipment",
        "owner_confirmation_required"
      ],
      "sourceEvidence": {
        "activityTypeCounts": {
          "rotation": 40
        },
        "bookingCount": 40,
        "canonicalLabels": [
          "F2",
          "F2 Cond",
          "Vault F2"
        ],
        "labelMentionsAllEquipmentCount": 40,
        "sourceConfidenceCounts": {
          "high": 40
        },
        "sourceReviewStatusCounts": {
          "auto_extracted": 36,
          "color_inferred": 4
        }
      },
      "suggestedBoardKind": "single_area"
    },
    {
      "candidateId": "zone-f3",
      "confidence": "high",
      "displayName": "F3",
      "equipment": [
        "F3"
      ],
      "logicalZoneId": "f3",
      "mayRepresentDisconnectedAreas": false,
      "ownerReview": {
        "configurationEligible": false,
        "confirmed": false,
        "status": "owner_confirmation_required"
      },
      "reasonCodes": [
        "equipment_exactly_matches_schedule_inventory",